<?xml version='1.0' encoding='UTF-8'?>
<?xml-stylesheet href="../../xslt/decodeMonster.xsl" type="text/xsl"?>
<monsters xmlns:xsi="http://www.w3.org/2001/XMLSchema-instance" xsi:noNamespaceSchemaLocation="../../schema/monster.xsd">
  <monster>
    <name>WYRM DE FEU</name>
    <type>CRÉATURE</type>
    <level>9</level>
    <creatureTraits>
      <trait type="size" ref="trait-tres-grande">TRÈS GRANDE</trait>
      <trait ref="trait-elementaire">ÉLÉMENTAIRE</trait>
      <trait ref="trait-feu">FEU</trait>
    </creatureTraits>
    <perception>
      <bonus/>
    </perception>
    <attributes STR="+0" DEX="+0" CON="+0" INT="+0" WIS="+0" CHA="+0"/>
    <interactionAbilities>
      <special>
        <name>Langue</name>
        <description>pyrique</description>
      </special>
      <special>
        <name>Compétence</name>
        <description>Acrobaties +20</description>
      </special>
      <special>
        <name>For</name>
        <description>+5, **Dex **+5, **Con **+4, **Int **–1, **Sag **+3, **Cha **+0</description>
      </special>
      <special>
        <name>Vision malgré la fumée</name>
        <description>Le wyrm de feu ignore l’état masqué à cause de la fumée�</description>
      </special>
    </interactionAbilities>
    <armorClass>28</armorClass>
    <saves REF="+0" FOR="+0" WIL="+0"/>
    <health>165</health>
    <immunities>
      <immunity>feu</immunity>
      <immunity>paralysé</immunity>
      <immunity>poison</immunity>
      <immunity>saignement</immunity>
      <immunity>sommeil</immunity>
    </immunities>
    <weaknesses>
      <weakness>
        <name>eau</name>
        <value>10</value>
      </weakness>
    </weaknesses>
    <speeds>
      <speed>0 m</speed>
    </speeds>
    <strikes>
      <strike type="melee">
        <name>queue</name>
        <bonus>+20</bonus>
        <traits>
          <trait>allonge 4,5 m</trait>
        </traits>
        <damages>
          <damage>
            <amount>2d8+11</amount>
            <damageType>de feu</damageType>
          </damage>
          <damage>
            <amount>2d8</amount>
            <damageType>de feu persistants</damageType>
          </damage>
        </damages>
      </strike>
      <strike type="ranged">
        <name>flammèche</name>
        <bonus>+20</bonus>
        <traits>
          <trait>facteur de portée 18 m</trait>
        </traits>
        <damages>
          <damage>
            <amount>2d8+6</amount>
            <damageType>de feu</damageType>
          </damage>
        </damages>
      </strike>
    </strikes>
    <offensiveAbilities>
      <special type="activity" actions="2">
        <name>Souffler du feu</name>
        <traits>
          <trait ref="trait-feu">feu</trait>
          <trait ref="trait-primordiale">primordiale</trait>
        </traits>
        <description>� Le wyrm de feu souffle un cône de feu de 9 m qui inflige 7d6 dégâts de feu et 2d8 dégâts de feu persistants à toutes les créatures qui se trouvent dans la zone d’effet (jet de Réflexes basique DD 28)� Le wyrm de feu ne peut plus utiliser souffler du feu pendant 1d4 rounds�</description>
      </special>
      <special>
        <name>Brasier élémentaire</name>
        <description>Les brasiers élémentaires sont des incendies ambulants constitués d’un feu incroyable‑ ment chaud, annonciateurs de destruction et de chaos. Plus stratégiques que nombre d’autres élémentaires, les brasiers mettent parfois le feu à des villes entières pour dérouter leurs ennemis.</description>
      </special>
    </offensiveAbilities>
  </monster>
</monsters>
