<?xml version='1.0' encoding='UTF-8'?>
<?xml-stylesheet href="../../xslt/decodeMonster.xsl" type="text/xsl"?>
<monsters xmlns:xsi="http://www.w3.org/2001/XMLSchema-instance" xsi:noNamespaceSchemaLocation="../../schema/monster.xsd">
  <monster>
    <name>IRNAKURSE</name>
    <type>CRÉATURE</type>
    <level>9</level>
    <creatureTraits>
      <trait type="size" ref="trait-grande">GRANDE</trait>
      <trait ref="trait-aberration">ABERRATION</trait>
    </creatureTraits>
    <perception>
      <bonus/>
    </perception>
    <languages>
      <language>chthonien</language>
      <language>elfique</language>
      <language>sakvroth (incapable de parler)</language>
    </languages>
    <skills>
      <skill>
        <name>Acrobaties</name>
        <bonus>+20</bonus>
      </skill>
      <skill>
        <name>Athlétisme</name>
        <bonus>+20</bonus>
      </skill>
      <skill>
        <name>Discrétion</name>
        <bonus>+20</bonus>
      </skill>
    </skills>
    <attributes STR="+0" DEX="+0" CON="+0" INT="+0" WIS="+0" CHA="+0"/>
    <interactionAbilities>
      <special>
        <name>For</name>
        <description>+5, **Dex **+5, **Con **+3, **Int **–2, **Sag **+3, **Cha **+4</description>
      </special>
    </interactionAbilities>
    <armorClass>28</armorClass>
    <saves REF="+0" FOR="+0" WIL="+0"/>
    <health>152</health>
    <speeds>
      <speed>0 m</speed>
    </speeds>
    <strikes>
      <strike type="melee">
        <name>mâchoires</name>
        <bonus>+20</bonus>
        <traits>
          <trait>allonge 3 m</trait>
        </traits>
        <damages>
          <damage>
            <amount>2d12+11</amount>
            <damageType>perforants</damageType>
          </damage>
        </damages>
      </strike>
      <strike type="melee">
        <name>tentacule</name>
        <bonus>+20</bonus>
        <traits>
          <trait>agile</trait>
          <trait>allonge 6 m</trait>
        </traits>
        <damages>
          <damage>
            <amount>2d8+11</amount>
            <damageType>tranchants</damageType>
          </damage>
        </damages>
      </strike>
    </strikes>
    <offensiveAbilities>
      <special>
        <name>Fouet mental</name>
        <traits>
          <trait ref="trait-emotion">émotion</trait>
          <trait ref="trait-mental">mental</trait>
          <trait ref="trait-occulte">occulte</trait>
        </traits>
        <description>� Une créature touchée par le tentacule d’un irnakurse est submergée d’images ignobles d’une existence anéantie et doit réussir un jet de Volonté DD 28 ou être étourdie 2 (ou étourdie 4 en cas d’échec critique)� Après avoir effectué ce jet de sauvegarde, la créature est immunisée contre fouet mental pendant 24 h�</description>
      </special>
      <special type="activity" actions="2">
        <name>Hurlement de l’âme</name>
        <description>(audible, concentration, émotion, mental, occulte) ; **Fréquence** 1 fois/jour ;</description>
      </special>
      <special>
        <name>Succès critique</name>
        <description>La créature n’est pas affectée et est immunisée contre Hurlement de l’âme pen- dant 24 h�</description>
      </special>
      <special>
        <name>Succès</name>
        <description>La créature est stupéfiée 1 pendant 1 round�</description>
      </special>
      <special>
        <name>Échec</name>
        <description>La créature est stupéfiée 1� Si la cible rate d’autres jets de sauvegarde contre Hurlement de l’âme, l’intensité de l’état augmente de 1 (jusqu’à un maximum de stupéfié 4)� Chaque fois que le personnage profite d’une nuit complète de repos, son état stupéfié à cause de Hurlement de l’âme est réduit de 1�</description>
      </special>
      <special>
        <name>Échec critique</name>
        <description>Comme un échec mais l’état stupéfié aug- mente de 2 au lieu de 1�</description>
      </special>
      <special>
        <name>Tempête de tentacules</name>
        <description>L’irnakurse effectue jusqu’à quatre Frappes de tentacule, chacune d’elles visant une cible diffé- rente� Ces attaques comptent pour le malus d’attaques multiples de l’irnakurse mais ce malus n’augmente qu’une fois toutes les attaques effectuées�</description>
      </special>
    </offensiveAbilities>
  </monster>
</monsters>
