<?xml version='1.0' encoding='UTF-8'?>
<?xml-stylesheet href="../../xslt/decodeMonster.xsl" type="text/xsl"?>
<monsters xmlns:xsi="http://www.w3.org/2001/XMLSchema-instance" xsi:noNamespaceSchemaLocation="../../schema/monster.xsd">
  <monster>
    <name>GRIKKITOG</name>
    <type>CRÉATURE</type>
    <level>14</level>
    <creatureTraits>
      <trait type="size">TRÈS GRANDE</trait>
      <trait>ABERRATION</trait>
      <trait>TERRE</trait>
      <trait>TERRE</trait>
    </creatureTraits>
    <perception>
      <bonus>+29</bonus>
      <senses>
        <sens>
          <name>perception des vibrations</name>
          <precision>imprécis</precision>
          <range>9 m</range>
        </sens>
        <sens>
          <name>vision dans le noir</name>
        </sens>
        <sens>
          <name>vision multiple</name>
        </sens>
      </senses>
    </perception>
    <languages/>
    <skills>
      <skill>
        <name>Athlétisme</name>
        <bonus>+28</bonus>
      </skill>
      <skill>
        <name>Duperie</name>
        <bonus>+27</bonus>
      </skill>
      <skill>
        <name>Survie</name>
        <bonus>+25</bonus>
      </skill>
    </skills>
    <attributes STR="+8" DEX="+4" CON="+5" INT="+2" WIS="+5" CHA="+5"/>
    <interactionAbilities>
      <special type="activity" actions="3">
        <name>Implantation du cœur</name>
        <traits>
          <trait>manipulation</trait>
        </traits>
        <description>� Le grikkitog implante son cœur dans une section adjacente de terre ou de pierre, s’y mêlant parfaitement et modifiant son apparence pour se confondre avec la roche environnante� Il est immobilisé mais réussit automatiquement ses tests de Duperie pour Se déguiser et prendre l’apparence de la pierre autour de lui� Les créa- tures le cherchant activement peuvent toujours tenter des tests normaux de Perception contre son DD de Duperie� Un grikkitog peut renoncer à cette implantation avec une action gratuite qui a le trait manipulation� L’aura d’infestation du grikkitog et sa vision multiple ne sont actives que quand il est implanté�</description>
      </special>
      <special>
        <name>Vision multiple</name>
        <description>Tant que son cœur est implanté, le grikkitog peut voir à travers les yeux qu’il crée dans toute la zone de son aura d’infestation et il gagne l’avantage d’une vision à 360° (p� 316)�</description>
      </special>
    </interactionAbilities>
    <armorClass>36</armorClass>
    <saves REF="+23" FOR="+28" WIL="+24"/>
    <health>200</health>
    <reactiveAbilities>
      <special>
        <name>Aura d’infestation</name>
        <traits>
          <trait>aura</trait>
          <trait>occulte</trait>
          <trait>terre</trait>
        </traits>
        <description>36 m� Tant que son cœur est implanté, un grikkitog infecte toute la terre et toutes les pierres situées dans un rayon de 36 m tant qu’il a un lien physique direct avec ces substances, y compris les objets en pierre en contact avec le sol� Cet effet se propage même si le grikkitog n’a pas de ligne d’effet� Il ne peut cependant affecter la terre et la pierre à la surface et exposées à l’air que si au moins une partie de son cœur est également exposée� Dans son aura, il peut générer des gueules et des yeux partout où il veut� Il peut effectuer des attaques avec ses mâchoires contre n’importe quelle créature, attaques provenant d’une zone de pierre ou de terre comprise dans l’aura et adjacente à cette créature� Déterminez l’abri en fonction du point d’origine de l’attaque et non du cœur du grikkitog�</description>
      </special>
    </reactiveAbilities>
    <speeds speedSpecial="glisse à travers la terre">
      <speed>6 m</speed>
      <speed type="burrow">6 m</speed>
    </speeds>
    <strikes>
      <strike type="melee">
        <name>mâchoires</name>
        <bonus>+29</bonus>
        <traits>
          <trait>magique</trait>
        </traits>
        <damages>
          <damage>
            <amount>3d12+14</amount>
            <damageType>perforants</damageType>
          </damage>
        </damages>
      </strike>
    </strikes>
    <offensiveAbilities>
      <special>
        <name>Glisse à travers la terre</name>
        <description>Le grikkitog peut se déplacer à sa Vitesse de creusement normale en Creusant à travers la terre et la pierre en ne laissant derrière lui aucun tunnel ou signe de son passage�</description>
      </special>
      <special type="activity" actions="0">
        <name>Gueule barbelée</name>
        <trigger>Le grikkitog touche une créa- ture avec une Frappe de mâchoires ;</trigger>
        <effect>Le grikkitog plante ses dents barbelées dans la cible qui doit réussir un jet de Réflexes DD 34 ou être immobilisée� Tant qu’elle est immobilisée, la victime subit 3d8 dégâts de saignement persistants et le grikkitog se nourrit de sa chair� La créature est immobilisée jusqu’à ce que le grikkitog mette un terme à cet effet avec une action gratuite ou jusqu’à ce que la cible réussisse un test DD 38 pour S’échapper� Le grikkitog peut immobiliser n’importe quel nombre de créatures avec ses gueules�</effect>
      </special>
    </offensiveAbilities>
  </monster>
</monsters>
